{
  "schema_version": 1,
  "matrix_id": "aidr-privacy-data-flow-matrix",
  "status": "open",
  "updated_at": "2026-10-06",
  "deployment_scope": "Source inventory only: aidr self-hosted/Supabase, separately deployed aidr-landing Clerk/Firestore/Polar, optional privacy text service and MCP gateway; no deployed customer scope selected or accepted",
  "flows": [
    {
      "flow_id": "DF-001",
      "data_class": "local detection and evidence",
      "fields": [
        "tool inputs",
        "extracted URLs and paths",
        "verdicts",
        "incident records"
      ],
      "source": "packages/core/src/evaluator.ts; packages/core/src/audit-log.ts",
      "purpose": "local evaluation and evidence recording",
      "trigger": "tool evaluation or local audit configuration",
      "destination": "Runtime process and configured local JSONL audit/incident files; remote paths recorded separately",
      "destination_domain": "unknown",
      "region": "unknown",
      "subprocessor": "unknown",
      "lawful_basis": "unknown",
      "retention": "unknown",
      "deletion": "unknown",
      "access": "Runtime OS user; actual host ACLs, backup readers and operator access require host evidence",
      "transfer_mechanism": "unknown",
      "evidence": [
        "Source inspection only: packages/core/src/evaluator.ts",
        "Source inspection only: packages/core/src/audit-log.ts"
      ],
      "status": "inventory",
      "unknowns": [
        "destination_domain",
        "region",
        "subprocessor",
        "lawful_basis",
        "retention",
        "deletion",
        "transfer_mechanism"
      ]
    },
    {
      "flow_id": "DF-002",
      "data_class": "managed telemetry",
      "fields": [
        "installation and runtime identifiers",
        "verdict",
        "artifact hashes or summaries",
        "incident fields"
      ],
      "source": "packages/core/src/managed.ts; packages/core/src/clients/control-plane.ts; packages/core/src/telemetry-queue.ts; supabase/functions/ingest/events.ts",
      "purpose": "optional managed event synchronization",
      "trigger": "managed mode with audit synchronization enabled",
      "destination": "Configured managed ingest API and tenant event/incident database after a durable installation-bound local queue",
      "destination_domain": "unknown",
      "region": "unknown",
      "subprocessor": "unknown",
      "lawful_basis": "unknown",
      "retention": "unknown",
      "deletion": "unknown",
      "access": "Device credential for ingest, tenant-scoped database/API access and privileged deployment operators; actual grants require live evidence",
      "transfer_mechanism": "unknown",
      "evidence": [
        "Source inspection only: packages/core/src/managed.ts",
        "Source inspection only: packages/core/src/clients/control-plane.ts",
        "Source inspection only: packages/core/src/telemetry-queue.ts",
        "Source inspection only: supabase/functions/ingest/events.ts"
      ],
      "status": "inventory",
      "unknowns": [
        "destination_domain",
        "region",
        "subprocessor",
        "lawful_basis",
        "retention",
        "deletion",
        "transfer_mechanism"
      ]
    },
    {
      "flow_id": "DF-003",
      "data_class": "central discovery metadata",
      "fields": [
        "tenant and collector identifiers",
        "cycle identifier",
        "origin",
        "reachability and error code"
      ],
      "source": "supabase/functions/discovery/logic.ts",
      "purpose": "optional central discovery collection",
      "trigger": "configured discovery collection or upload",
      "destination": "Configured discovery API and tenant-scoped discovery tables; collector origins reject paths, query strings and embedded credentials",
      "destination_domain": "unknown",
      "region": "unknown",
      "subprocessor": "unknown",
      "lawful_basis": "unknown",
      "retention": "unknown",
      "deletion": "unknown",
      "access": "Authenticated tenant collector and configured dashboard tenant roles; actual grants require live evidence",
      "transfer_mechanism": "unknown",
      "evidence": [
        "Source inspection only: supabase/functions/discovery/logic.ts"
      ],
      "status": "inventory",
      "unknowns": [
        "destination_domain",
        "region",
        "subprocessor",
        "lawful_basis",
        "retention",
        "deletion",
        "transfer_mechanism"
      ]
    },
    {
      "flow_id": "DF-004",
      "data_class": "deep-scan input and result",
      "fields": [
        "scan type",
        "target and options",
        "agent config and optional prompt",
        "configured evaluation model/base URL/token",
        "findings and task state"
      ],
      "source": "packages/core/src/aig-scan-client.ts",
      "purpose": "optional deep scanning",
      "trigger": "operator-configured scan request",
      "destination": "Configured AIG_BRIDGE_URL (source default http://localhost:8099), then configured AIG task service and any selected scan/model provider",
      "destination_domain": "unknown",
      "region": "unknown",
      "subprocessor": "unknown",
      "lawful_basis": "unknown",
      "retention": "unknown",
      "deletion": "unknown",
      "access": "Configured authenticated bridge caller, tenant task authorization, bridge/AIG service operators; upstream provider access unresolved",
      "transfer_mechanism": "unknown",
      "evidence": [
        "Source inspection only: packages/core/src/aig-scan-client.ts"
      ],
      "status": "inventory",
      "unknowns": [
        "destination_domain",
        "region",
        "subprocessor",
        "lawful_basis",
        "retention",
        "deletion",
        "transfer_mechanism"
      ]
    },
    {
      "flow_id": "DF-005",
      "data_class": "URL reputation lookup",
      "fields": [
        "eligible extracted URL",
        "product/runtime version",
        "optional authentication header"
      ],
      "source": "packages/core/src/clients/url-check.ts",
      "purpose": "optional URL reputation lookup",
      "trigger": "URL reputation feature enabled",
      "destination": "Configured url_check.endpoint; source default https://aidr-proxy.svc.singularityrd.com/url-check. Eligible URL lookup may disclose hostname/path; credentials/fragments and non-opted-in query URLs are withheld",
      "destination_domain": "unknown",
      "region": "unknown",
      "subprocessor": "unknown",
      "lawful_basis": "unknown",
      "retention": "unknown",
      "deletion": "unknown",
      "access": "unknown",
      "transfer_mechanism": "unknown",
      "evidence": [
        "Source inspection only: packages/core/src/clients/url-check.ts"
      ],
      "status": "inventory",
      "unknowns": [
        "destination_domain",
        "region",
        "subprocessor",
        "lawful_basis",
        "retention",
        "deletion",
        "access",
        "transfer_mechanism"
      ]
    },
    {
      "flow_id": "DF-006",
      "data_class": "file and package reputation lookup",
      "fields": [
        "SHA-256 file/package hashes",
        "package name/version",
        "registry response metadata",
        "optional configured reputation authentication"
      ],
      "source": "packages/core/src/clients/file-check.ts; packages/core/src/clients/package-registry.ts",
      "purpose": "optional file and package reputation lookup",
      "trigger": "file or package reputation feature enabled",
      "destination": "Configured file reputation endpoint and public registry metadata APIs (registry.npmjs.org and pypi.org); signed local feed may be selected separately",
      "destination_domain": "unknown",
      "region": "unknown",
      "subprocessor": "unknown",
      "lawful_basis": "unknown",
      "retention": "unknown",
      "deletion": "unknown",
      "access": "unknown",
      "transfer_mechanism": "unknown",
      "evidence": [
        "Source inspection only: packages/core/src/clients/file-check.ts",
        "Source inspection only: packages/core/src/clients/package-registry.ts"
      ],
      "status": "inventory",
      "unknowns": [
        "destination_domain",
        "region",
        "subprocessor",
        "lawful_basis",
        "retention",
        "deletion",
        "access",
        "transfer_mechanism"
      ]
    },
    {
      "flow_id": "DF-007",
      "data_class": "version check metadata",
      "fields": [
        "AIDR/runtime version",
        "OS/version and architecture",
        "optional installation ID",
        "optional authentication header"
      ],
      "source": "packages/core/src/version-check.ts",
      "purpose": "optional version update check",
      "trigger": "configured session-start or update check",
      "destination": "Source default https://aidr-proxy.svc.singularityrd.com/v1/version-check; skipped for development versions or AIDR_SKIP_VERSION_CHECK=1",
      "destination_domain": "unknown",
      "region": "unknown",
      "subprocessor": "unknown",
      "lawful_basis": "unknown",
      "retention": "unknown",
      "deletion": "unknown",
      "access": "unknown",
      "transfer_mechanism": "unknown",
      "evidence": [
        "Source inspection only: packages/core/src/version-check.ts"
      ],
      "status": "inventory",
      "unknowns": [
        "destination_domain",
        "region",
        "subprocessor",
        "lawful_basis",
        "retention",
        "deletion",
        "access",
        "transfer_mechanism"
      ]
    },
    {
      "flow_id": "DF-008",
      "data_class": "runtime diagnostics",
      "fields": [
        "scrubbed event attributes",
        "bounded request status and duration",
        "local audit context"
      ],
      "source": "packages/core/src/telemetry-redaction.ts; packages/core/src/sentry.ts; deploy/dashboard/monitoring.mjs",
      "purpose": "optional runtime reliability and security diagnostics",